subreddit,post_title,post_content,post_author,post_score,num_comments,created,comments,url,mentioned_tickers,post_sentiment,post_word_score,comment_sentiment,comment_score,comment_word_scores,overall_sentiment,overall_score,num_comments_analyzed
stocks,Currently maxing out target date fund. Anything else I should be doing?,"Hello, I am currently maxing out my 403b by investing in the vanguard target date fund, and my Roth IRA. My work also offers a 457b account which I am considering maxing out from next year onwards once I have a decent emergency fund saved up this year. This would be a total of ~$47,000 in pretax investments per year. What I worry about is that this doesn’t leave me much to invest on my own. But I feel investing pretax and decreasing my AGI by doing so is a better way to go about this. Is there anything else I should be doing? All advice is appreciated. Thank you. 

Also does anyone know the life time return on vanguard target date funds? Thanks. ",ponderingmeerkat,96.0645,11,2025-06-18 21:22:32,"[""I honestly don't agree with many people here. Most of them are gambling.\n\nVanguard's targeted date fund is perfectly fine."", ""Historically these funds do not have a good mix of bonds and stocks.  \n\nBasically they go heavily into bonds way too early in the clients life cycle losing them a ton of profit.  \n\nThat said, it all depends.  They can be good for people who never want to be hands-on.  Also for people heading into retirement with little money.  Someone who is receiving a smaller payout in Social Security probably can't afford to be aggressively (or moderately) into stocks."", 'How close are you to retirement?\n\nIMHO - if not within the next 15 years, you should really own no bonds and be 100% in stocks funds.\n\nSo if you will retire at 65, I wouldn’t worry about bonds until 50.\n\nThis may seem unconventional but bond funds have bad returns and you really should be fine with 15 years of easing into them, assuming you actually want to own them to theoretically reduce your investment risk for steady bond payments (assuming the government can continue to make those payments forever).', 'Stop putting money in bond funds.  The returns are horrific.  If you really want to hold bonds, just buy treasuries directly.', ""Just set a reminder to rebalance every 5 years. Takes 10 minutes.  \n\nYou'll save tens of thousands and gain significant upside."", 'As others have stated, target date funds have almost always under performed. In the last 10-15 years, they have under performed by a lot due to low interest rates.', 'Target Dates do not have a great rate of return. I would liquidate some or all of it and get an S&P 500 Index ETF or mutual fund (IVV, VOO.\n\nA total market index fund could be a good idea as well, such as VTI.', 'I switched from target date fund to large cap and non-usa fund 75-25 mix. They have a higher rate of return than the target date fund.', "">What I worry about is that this doesn’t leave me much to invest on my own. But I feel investing pretax and decreasing my AGI by doing so is a better way to go about this. Is there anything else I should be doing?\n\nMy long term plan had been to target early retirement.  When I realized I couldn't touch my retirement funds early without penalty, I started to divert more money to cash brokerage and build up my portfolio there.  All I would need in the brokarge is enough funds to cover the gap from retirement date, to when I could access retirement funds.\n\nIn terms of dollar for dollar amount which is better - well that has no value to me if it prevents me from retiring early.\n\nAnother reason I took some for brokerage is most of my employer 401k plans only supported funds and ETF's.  I've done much better with individual stocks.  So those gains more than outweight any tax benefits."", 'Other ideas to consider:\n\nBackdoor Roth (if income is high enough to phase you out of direct Roth contributions)\n\nHSA contributions (if you’re eligible — the triple tax advantage is unbeatable)\n\nTaxable brokerage for long-term flexibility once tax-advantaged space is maxed\n\nChecking in on your asset allocation across all accounts — target date funds handle this, but if you start a taxable account, you might want to adjust for tax-efficiency', ""Liquidate your target date fund immediately.  It's a fundamentally flawed investment product, let alone one for retirement.\n\n  \nYou are better off with IVV or QQQ. Bonds have terrible risk/reward in current environment.""]",https://reddit.com/r/stocks/comments/1ley9d3/currently_maxing_out_target_date_fund_anything/,['TGT'],positive,93.1,positive,63.6955909090909,"[105.57650000000001, 63.485, 20.165, 21.346999999999998, 95.301, 64.6705, 86.7855, 50.0, 94.22749999999999, 84.1845, 14.909000000000006]",positive,76.64315454545454,11
investing,Amazon's $84M stake on AMD. A sleeper AI bet?,"Amazon bought 822,234 shares of AMD, worth about $84.5 million as of March 31. It’s the first time Amazon has ever disclosed a stake in the semiconductor company. It also happened to be the only new position in their entire portfolio last quarter.

At the time of the filing, AMD’s stock was down \~6% YTD while the broader chip sector was almost flat. Then, just one week after the 13F dropped, AMD announced a $6B stock buyback boosting its total repurchase capacity to $10B. This came right after unveiling a $10B AI partnership with Saudi-backed startup Humain, which is building Arabic LLMs and data center infrastructure across the Middle East.

Amazon’s cloud division, AWS, already uses AMD’s EPYC chips in some of its instances. With Nvidia supply tight and AMD pushing its MI300X AI accelerators, the move might hint at deeper strategic alignment. It’s also possible Amazon wanted to lock in a chip partner for its growing AI infrastructure push especially as it faces off with Microsoft and Google.

AMD was trading nearly 40% off its 52-week high when Amazon bought in.

Think AMD’s a smart AI play this year? What other AI stocks are you holding for the long haul?",Icy_Abbreviations167,94.3195,16,2025-06-19 11:31:27,"['Isn’t this because of the ZT-systems acquisition?', 'Amazing how they timed it perfectly and bought at the very bottom huh?', ""AMD talked about their new chips (they're really just floating point monsters that happen to be good at gaming and LLMs) and there's a lot of literature on them in the past week.\n\nAmazon makes their own AI chips and they're making a lot of them but just for in-house use and for use in AWS.\n\nIt may be that they bought it because they think that it's a good investment.\n\nI'm considering doing a PC build myself and AMD wins by a mile over Intel right now. They are talking about a 48 core chip for Nova Lake but I'm wondering if it will use commensurately more power compared to 15th gen."", 'Spamming every sub. Someone is holding an AMD bag.', 'AMZN buying $84M worth of AMD is the same level of conviction expressed if i were to find a nickel in my cupholder and buy $0.05 worth of AMD. And I may even be overstating my investment here...', ""I exited yesterday fearing the trump's move on iran. Hoping to get back in at lower price."", ""CUDA is a moat for NVDA but not an insurmountable one(ok, not CUDA, but the whole ecosystem of tools, libraries, etc).\n\nOn the one hand, I think AMD is a smart play if higher level libraries make AMD chips attractive by making them usable.\n\nOn the other hand, AMD is probably not charging premium prices and won't make all that much money per unit like NVDA.  Also the reasoning behind AMD and other non-NVDA AI is that NVDA just sits there while AMD and others steals their lunch and I don't see that happening."", '[Source](https://www.levelfields.ai/news/why-did-amazon-just-buy-84-million-worth-of-amd-stock)', 'Am I missing something here? $84M is nothing.', 'OP’s arms: I’m tired boss', 'Bro, that’s 0.041%. I’d LOVE to see it increase to 1%+ though. It will be a strong signal of AWS partnership.', '$84m is nothing in this context. Scale matters.', 'AMD to me has more upside in the near term than NVDA just because NVDA was so ahead of the game and already had its explosive growth phase. As long as Lisa Su isn’t like, lying, the 40% cheaper and 3x stronger (compared to last year) MI350 should definitely cause some waves in the semis market. AMD is partnered with meta, msft, OpenAI, oracle, and will be the go to chip for xbox and PlayStations in the future. Next guidance should be really strong (mi350 release) and then EOY earnings should reflect that guidance. MI400 next year (10x) and then everything coming after (yearly product release cadence) should bode really well for the stock price, as AMD is only a sub 300B market cap company (Nvda is 3.5 trillion). Just a piece of the data center pie is gonna be a big swing for AMD', '$84m feels like tip money to Bezos but ngl this AMD move kinda genius', 'The real AI moat is the cuda software framework.  AMD does not have it.', 'Rekr, QUBT, ARQQ']",https://reddit.com/r/investing/comments/1lfdr0v/amazons_84m_stake_on_amd_a_sleeper_ai_bet/,"['NVDA', 'AMZN', 'MSFT', 'GOOG']",positive,88.1,positive,61.92509375,"[50.0, 124.40699999999998, 108.647, 1.8155000000000032, 77.2625, 22.8155, 100.773, 50.0, 21.640000000000004, 6.086000000000002, 103.62549999999999, 52.403, 92.17299999999999, 79.1535, 50.0, 50.0]",positive,74.88285625,16
