subreddit,post_title,post_content,post_author,post_score,num_comments,created,comments,url,mentioned_tickers,post_sentiment,post_word_score,comment_sentiment,comment_score,comment_word_scores,overall_sentiment,overall_score,num_comments_analyzed
investing,How do you explain MSCI China not being higher?,"I was looking at the MSCI of some countries out of curiosity (maybe to invest?) and was surprised to see that China (among other countries) didn't have some hockey stick. When I think of what this country was like 30 years ago and today (compared to the USA)

How can this be explained? What is your intuition behind that?",mr_bleez,90.93549999999999,16,2025-06-19 02:44:31,"['A couple of the major things are:\n\nForeign investors have some worry of govt actions. The Chinese govt is heavily involved in their businesses and could more directly nationalize them or direct them in ways that wouldn’t benefit the foreign shareholders.\n\nChinese equity ownership is odd as well where a foreign investor (or domestic for that matter) doesn’t have the same ownership and rights that an owner in countries like the U.S. have, which makes owning Chinese stocks economically different for the investor.\n\nThere are some European banks and govts who still seem pretty unhappy with China and are no longer behaving how they used to with them. China pushed out a lot of western capital and financiers in favor of other national goals and interests, so it’s not getting flooded with foreign capital like it used to, or the way fast growing economies usually have been. The Chinese came to see these western institutions as a threat (which, in fairness isn’t wrong for them to think,) and ever since they’ve been pushed out there has been a hard pullback.\n\nThe Chinese generally work to devalue the Yuan relative to the USD and EUR in particular so knowing that there is intentional currency devaluation adds currency risk to owning Chinese assets.\n\nThe Chinese economy may be switching to a different larger strategic vision away from the rapid growth of capital and asset values and toward something else. Different people have different theories on what the Chinese strategic vision is, but it seems to be something different than Dengism, maybe something more rooted in Han nationalism, perhaps a return of some of their old Maoist elements, maybe even some new top- down infrastructure and development plans. I don’t know, but it does look like it’s something different. \n\nChinese equities may be undervalued, but other indices could just be overvalued. Maybe a combination of the two. When that belief in the equity market growth story is gone however, that seems to have a way of beating a market down about as bad as anything can.', ""economic growth is not equal to stock growth\n\n\nIn most countries most companies aren't listed for public. Especially in a communist planned economy!\n\nYou are comparing apples with oranges."", ""The economy and stock market aren't always the same thing.  China's real economy has grown a lot.  But their major industries still have a lot of state control.  They can shut down a successful company overnight or massively subsidize a desired industry.  And despite the government oversight, there's not much transparency to shareholders when it comes to accounting at Chinese companies.  Your investment returns are basically up to them, and you're not their priority.  They have very little interest in cultivating an environment where foreign investors are able to extract profits from China's growth.  It's never going to be a level playing field where outside investors see all the benefits of China's growth.  Ordinary Chinese investors with no inside connections are also at a disadvantage and have tended to favor real estate investment instead."", 'In 2010, I invested in a handful of Chinese stocks.  Strong balance sheets, incredible growth rates funded by cash flow.  Emerging markets had outperformed SPY by about 24 points per year 2003-2007, then crashed.  This was their big bounce back.  \n\nTwo made it into the Investor Business Daily 100 fueling their momentum. I sold after doubling my money.  Watched them all climb higher.  Then they all had serious issues.  Most I would consider accounting fraud.  One just flat out lied about sales.  Another said they built a factory to supply their growth, but the Chinese government wouldn’t let them use it, so they had to rebuild near by.  Probably BS. \n\nI dodged a bullet. Someone else can take that risk. Fraud and unreliable accounting are a hard pass for me.  Did we ever find out the details of why Jack Ma went missing?  Do forced labor camps enable China’s manufacturing dominance?  Those aren’t questions I want to ask about my investments.', 'There is no rule of law in China. The CCP can stop the stock market at any time and there is precedent where citizens have stolen shares from foreign businesses.', 'There are a number of factors including government interference and some underlying structural issues in their economy.\n\nBut for me it’s jsut that I don’t feel like I can’t trust their numbers at all. Lots of cases of fraud in Chinese business and lots of numbers that don’t add up both in private and public institutions. \n\nAnd if there is fraud and a big loss for investors you foreigners don’t have the same rights to recoup part of the investment as you might have in the us.\n\nIf I could be 99 % sure that every number on the books was real I’d consider investing', 'Not all economies are so finance-heavy. When you see the growth of stock market in countries like the US in the 1990s or 2010s or Europe in the 1950s you also need to take into account that those countries rely heavily on finance to boost growth: loans, issuing debt, stock selling, etc. This means that a lot of their ""growth"" is reflected in the stock market because the moment they need to grow they become ""public"".\n\n Countries like China or Russia rely more on state-backed or private funding and so you won\'t see that growth. For instance, when AliBaba went public it was already a juggernaut in China, so any growth from that point forward dealt with the inertia of being so large. By the time $BABA IPO\'d it was worth $240b. The growth from a few thousand dollars in the late 1990s to the multi-billion dollar corporation was invisible for the stock market at large', 'Bc Americans should now believe that those buying large amounts of Chinese stock will be documented. Not a popular mention at cocktail parties.', ""It's an interesting discussion! MSCI China’s performance has faced headwinds from regulatory crackdowns and economic slowdowns, which have weighed on investor sentiment. Personally, I frame it as a reminder that emerging markets come with both high potential and higher risks. Do you typically hedge with other regional ETFs or prefer to ride out the volatility when holding Chinese assets?"", 'The stock market and economic growth dont correlate. Also as an economy grows heavily, the inclusion of new companies into a countries stock market dilutes individual share prices. There was a rational reminder episode and or ben felix episode on this', 'China’s economy exploded, but its stock market didn’t get the memo. Between state control, low investor trust, and profits not always flowing to shareholders, it makes sense the MSCI China hasn’t mirrored the country’s growth.', 'They also issue more shares than mature western companies.', ""U.S. equities is the best performing one (not just compared to China, but everyone else) primarily due to the U.S. dollar being the one and only reserve currency, and the ever increasing U.S. debt (credit). It's a long story to explain it, but it's less related to the economy."", 'Currency manipulation and because it’s not a capitalistic country', 'Nice strategy keep continue', ""Maybe because they have an economic crisis of their own?\n\nPeople are not paying into pension, and the next 10 years are going to be very hard on them.\n\nThe govt. is strictly governing over monetary policy, and they really need to have a market income surplus of quite a lot to keep on innovating.\n\nPlus: they are moving more towards robotic factories, meaning less human power needed. Problem is, what do you do with this whole lot of unemployed people then?\n\nBut they have to move into that direction because otherwise, production will actually move back to industrialized western nations after eliminating the super high cost of labour here.\n\n  \nThey have a massive lot of potential though, just keep in mind that, unless you're in China yourself, you do not own anything there and can get wiped out any time the government desires that. They have an iron fist on their property like nobody else.""]",https://reddit.com/r/investing/comments/1lf412c/how_do_you_explain_msci_china_not_being_higher/,[],positive,110.0,positive,67.84146875,"[68.38499999999999, 85.436, 98.5365, 8.395000000000003, 14.160500000000004, 31.815500000000004, 95.22500000000001, 79.561, 70.44699999999999, 85.5065, 95.3175, 96.17399999999999, 67.8545, 21.640000000000004, 91.7525, 75.25699999999999]",positive,77.07908125,16
investing,Acquired a UTMA account yesterday at 38 years old- and ~1300% gains,"I received a letter from E*trade this week about a brokerage account in mine and my dad’s name and after some research I discovered it was an old UTMA. It took a 5 min phone call for them to transfer the account into my taxable brokerage. 24 shares of Microsoft purchased at $34 now worth $11.5k.

A couple questions:

Will I owe capital gains taxes this year for receiving the account, even if I don’t withdraw?

Should I just leave it in MSFT and let it ride? I don’t follow MSFT and most of my other investing is in ETFs. 

There’s also a couple thousand in cash which I might move into the emergency fund that I’ve been aggressively building or hold for my backdoor Roth conversion in 2026 (both accounts with Fidelity). ",Breezy368,70.40849999999999,8,2025-06-19 06:39:53,"['1. No you won’t owe capital gains until you sell the position it’s a normal brokerage account that triggers taxes upon sale.\n\n2. This is up to your goals, and time horizon. Im a CFP as a general rule of thumb I don’t like one position to be more than 10% of invested assets.\n\n3. I think this is a great use of the cash if you are actively building your EF.', 'Weird usually those are required to be transferred to your name at 21. So 17 years went by without that happening? Wild', 'Nice.  My wife is 45 and can’t get her UGMA coke shares transferred by computer share despite doing the medallion and all that jazz.  And to read this sort of made it more infuriating.  The bank makes her 85 year old mom sign the dividend checks.  It’s not enough to spend more time on but still.\n\nEdit: very happy for you OP it was easy.  Worried that came across wrong.  All anger directed at computer share and the amoebic bureaucracy of crap like this.', 'You do owe taxes on the dividends received (technically you should have been paying those the whole time but the income is less than 100 dollars a year so probably not a big deal)', ""You don't owe capital gains taxes until you sell. Probably sell the MSFT as you harvest tax losses in other positions."", '> Will I owe capital gains taxes this year for receiving the account,\n\nGains happen when you start with cash, and sell back to cash.  You haven\'t sold.  No gains.\n\n>  even if I don’t withdraw?\n\nIn this type of account, ""withdraw"" is not the taxable event.  Sale is.  No sale, no taxable event.', 'Your dad passed? Ask the custodian about updating basis to date of death valuation', 'Don’t long term capital gains have reduced taxes compared to short term? You may only owe state income taxes. \n\nI am not a CPA']",https://reddit.com/r/investing/comments/1lf7lcl/acquired_a_utma_account_yesterday_at_38_years_old/,['MSFT'],positive,61.2,neutral,48.0075625,"[93.49149999999999, 33.2735, 58.904, 50.0, 23.415000000000003, 72.3055, -14.478999999999997, 67.15]",positive,56.9679375,8
investing,"Investing journey, what has yours been like","Curious to see when did you start, and what advice can you offer

For reference, 33M, own a condo (outstanding mortgage, $1500 a month with hoa and taxes included, we split between gf and myself) have a dog, no kids (yet)

Started investing in September 2017, was making 55k back then, been at same job for 9 years, make 110k plus bonus. 

Learned to live below my means, invest consistently into a Roth IRA, 401k with a 4% match and a brokerage account

Currently have between all 100k in brokerage, 60k Roth, 140k 401k ,and 8k between checking and savings 

Biggest things I’ve learned is it’s not about timing or making lots of money (although it speeds up process) it’s about time in plus patience, consistency and constantly learning and looking for sound investment opportunities ",riisenshadow92,103.72599999999998,6,2025-06-18 16:01:52,"[""> what advice can you offer\n\nThe biggest thing is that everyone's story is going to be different. Don't try to compare yourself to anyone else. All sorts of different ways to get to wherever you want or need to be, and really never know what kind of major life changes may be around the corner.\n\nHell I almost feel like the more certain you are about the trajectory you think you're on, the more likely the universe is going to throw you a curveball. 😅 Could be an inheritance, a divorce and splitting of assets, or any number of things."", ""I'm 39. My investing journey was chaotic initially, but quickly settled into a boglehead approach. Started with buying my first stock (Pepsi, I still have that 1 share plus dividends) and quickly threw a couple hundred dollars at a few companies. My strongest growth has come from those early investments but majority of my money is now in index funds. All accounts together I'm at close to 475k and I have about 140k equity in my home that me and my wife own together. \n\nI think the lessons from my journey could be to hold those early individual picks (most people have these) as long as you didn't put too much money into them. Potential gains in these conditions outweigh losses. Next, settle into regular index fund purchases. Why? Because at this point a 10% increase in the overall market results in an almost $35K increase for me. From just my slow and steady investment bucket"", ""Started working in 2009, was making 75k + RSU and bonus back then. Only put 5% into 401k target date fund to get match. I had no concept of investing so I put all my money in Wellsfargo with an interest of 0.1% or something. Bought a Condo in 2017 for 760k that is now worth 1M. Started investing for real in 2019. Currently have 1.3M between all accounts, with maybe 450k being gain. Completely missed out the 2010's bull run otherwise I could be retired right now."", 'Slowly started index funds ~15 years ago, it wasn\'t much starting out but I stuck to it and it\'s appreciated considerably since then. Went in big during Covid and got lucky. Quit my job, traveling the world. Getting by now with a handful of my own convictions. The extra earnings has given me margin to make mistakes. Here\'s what I\'ve got:\n\n- People will retroactively fit a philosophy or psychology as a narrative to success. Validation of having achieved that narrative is a very strong social desire.\n- The world is far more complicated than I once knew, and constructed in ways that can appear sometimes counter-intuitive to instinct. It\'s natural to believe that something is simple or even understood. I\'m constantly discovering how little I knew, and how lucky I\'ve been.\n- ""Le mieux est l\'ennemi du bien"". To reinforce your title, investment is a journey. The temptation to look at a graph, calculate net return from trough to peak, and say ""that\'s all it takes"", is not investing but rather accounting. Identifying the best moments in hindsight is just being a historian. If the future was a closed-form solution, then we wouldn\'t even be playing.', ""A friend taught me about IRAs and swing trading at the same time, so I combined those for about a year. Got out with roughly a 20% APY thankfully before I lost a lot of money. \n\nWent a decade-ish just plugging as much as I could automatically into 401(k)s and IRAs (until I hit income limits, and couldn't be bothered to do a backdoor), fully invested in target date funds. \n\nThen last year while taking a sabbatical, I spent some time doing the things we'd put off doing forever,  which included tracking down all my old 401(k)s. This in turn triggered an investing [special interest](https://en.wikipedia.org/wiki/Special_interest_%28autism%29?wprov=sfla1), and now here we are after consuming a shitton of Bogleheads threads. \n\nI point people towards http://efficientfrontier.com/ef/0adhoc/ifyoucan.pdf , or The Simple Path to Wealth. And https://www.kitces.com/blog/dont-save-10-of-income-spend-just-50-of-every-raise-and-systematically-save-more-tomorrow/ if they're going into a high-paying career. Investing is a solved problem, and we keep making it easier to do the right thing. The hard part of investing largely is not letting yourself try to be smarter than everyone else, and for most folks the best thing to do is fully automate a TDF and then put their efforts on making more money and spending less."", 'Started early in college around 2018 I thin and bought FGBRX or something like that, growth fund. Starting learning more and buying stuff to diversify. That only dragged my returns down and polarized me against it. Portfolio went through Covid and even with downswing overall growth fund performed much better. \n\nUnfortunately had to use the money forgetting about it for a while. Checked in on my rollover IRA after changing jobs and found I’m woefully behind for 28 and ramping back up.']",https://reddit.com/r/investing/comments/1ler18r/investing_journey_what_has_yours_been_like/,[],positive,122.5,positive,87.19174999999998,"[70.64049999999999, 86.9405, 87.398, 104.009, 97.83149999999999, 76.33099999999999]",positive,93.80545,6
investing,How do long term capital gains income tax brackets work?,"Iv seen the brackets and this seems simple enough but there seems to be some loopholes and I’m not sure how they are handled.

I had a taxable account in college because I did not earn enough to pay capital gains taxes. The plan was to invest in that, sell right before I got a job incurring no taxes and just reinvest. I ended up having to use the money so not sure if this would have worked. 

As far as I can tell an even bigger loophole if you have a lot in a taxable account is just to take 1 year off work, earn no income or just below the threshold, cash out and with income below the threshold pay no taxes on the gains? 

This also seems like a loophole with retirement making a taxable account functionally a Roth IRA? Could you not just in your first year of retirement with 0 income to report, withdraw all the money from your taxable account tax free? 

Feel like I’m probably missing something here. ",Odd-Flower2744,72.513,5,2025-06-19 09:11:41,"[""It's arguably not a loophole, but yes, that's how it works.\n\nIf you can limit your income to just proceeds from selling stock you've held long term, you can keep realized gains under the 0% tax threshold and owe nothing.\n\nThis being said, it's not a benefit to you in the long run to replace wages by prematurely depleting your investments.  In retirement it's absolutely a valid strategy."", ""capital gains count as income so you'll eventually bump up into the next bracket"", '> Could you not just in your first year of retirement with 0 income to report, withdraw all the money from your taxable account tax free?\n\nYour investment proceeds count as income, so no.', ""hey! here's a great idea - i'll forego my 100,000 for a year so i can sell 100,000 worth of capital gains and pay no tax!\n\nlet me see - salary after tax 78,000, cap gains after tax 80,000..............i'd be stuck with 158,000\n\nwho in their right mind would do that rather than having 100,000?"", ""there are no tax brackets for long term captial gains.  They don't exist in the tax code.\n\n1. When you sell shares you subract the purchase price from the money you made.  This is your capital gains\n2. You then take 20% of that money and add it to your other taxable income.(Work income interest income from bank.  Basically anything that payed you money during the year.This is your total income.\n3. They you subtract the standard deduction from your total income.the standard deduction is updated yearly and this year is it 15,000.\n4. You then deduct money for each dependent your have.\n5. Then you determine your filling status.  Single , Married filling jointly, or married filling separately.  This determines which  tax brackets you use.\n6. And from that you calculate the the tax. The tax brackets are buckets.   YOU fill the bucket of the lowest tax bracket and and calculate the tax for that bracket. Then you fill the second bracet and calculate ether tax for that bucket. You continue doing this until you have no more money to add to the buckets of the tax bracket.  then you add the tax for each bucket together and that is your tax.\n\nwhen you were in collage you had no work income.  And any money you made from bank interest or dividnends from your investment was wiped out by the standard deduction.  So you So you had no total income and therefore no tax.\n\nWhen people try to explain your taxes they tend to simplify everything by aasssuing you have only capital gains income, don mention the standard deductions or the tax buckets.  The then say you can make X ammount of money and pay not tax.  And then they call this the long term captial  gains tax bracket.\n\nThe myth that there is a spatial gains tax bracket was created by people oversimplifying the tax code.""]",https://reddit.com/r/investing/comments/1lfagtw/how_do_long_term_capital_gains_income_tax/,[],positive,69.3,positive,80.3015,"[80.97, 82.89999999999999, 76.121, 80.02199999999999, 81.4945]",positive,77.1861,5
investing,Thoughts on XAR given the conflict in the Middle East and elsewhere?,"I have been considering picking up some XAR to add to my portfolio (Aerospace & Defense ETF). Is there a better EFT or stock to consider in these times of heightened potential for conflict? Currently holding VOO and VTI, so perhaps those already cover the holdings in XAR.

If not XAR, what is a good alternative?",ZoomVulnerabilities,73.2845,0,2025-06-19 11:50:49,[],https://reddit.com/r/investing/comments/1lfe86y/thoughts_on_xar_given_the_conflict_in_the_middle/,"['VTI', 'VOO']",positive,69.2,neutral,50.0,[],positive,73.2845,0
