subreddit,post_title,post_content,post_author,post_score,num_comments,created,comments,url,mentioned_tickers,post_sentiment,post_word_score,comment_sentiment,comment_score,comment_word_scores,overall_sentiment,overall_score,num_comments_analyzed
stocks,Google likely to face $4.7 billion USD fine,"GOOG can't catch a break and likely to face fines in EU general court, however the penalty is not confirmed, only an advise by the Advocate General in EU court to dismiss Google's appeal against the fine that was proposed in 2022. This was the reason why goog took a dump before the market close on 18th June.

I am long goog, have $180C for August; hoping this is not a big dent. 

https://www.nbclosangeles.com/news/business/money-report/google-looks-likely-to-lose-appeal-against-record-4-7-billion-eu-fine/3727955/",chintan_joey,49.994,36,2025-06-19 13:57:12,"['> GOOG can’t catch a break\n\nPoor Google.', ""Slightly more than 4% of their revenue for a year. Before the 10-50x reduction when they settle. \n\nThat'll show them."", 'Operating income of $112 billion last year, doubt this has a meaningful impact\n\nEdit: net income of $100b', 'Bullish, analyst expectation was 4.8b billion! (Jk obv)', 'as a GOOG shareholder - i kinda love seeing fines. GOOG can pay it and move on. no long term effects', 'That explains why it dropped almost 1.5% in 10 mins yesterday before close. Knew there had to be some news on that drop.\n\nNow for the “it was actually priced in” comments and how wrong I am lol.', '$GOOGL puts for sept 30th ? 👀', 'EU’s entire strategy for technology is to just try to fine American companies into the ground lol', 'It dropped $21B on a one time $5B fine? Investors are actually dumb. I may go 50% in Google at this point.', 'honestly, i kind of wish more companies were willing to say ""we\'re not paying that. if you have a problem with it we just won\'t do business in the eu"".', 'The fact that Alphabet keeps fighting the EU despite its evident predatory practices says a lot about the company.', 'I’m buying the dip.', ""Donald won't be happy with this one"", 'Europoors. Making money by fining American companies who also happen to be the highest paying corps in Europoor land', 'Oh my god please crash so I can buy more!  This is one of my favorite companies as far as pushing the envelope and investing in R&D… one of the few stocks I just like having because I like what they do…', 'EU does what it does best - taxes, fines and penalties.', 'Sold my puts while the were down 70% not even an hour before it drops 2% lol', 'wow didnt expect that', 'And the fine will actually be $5.22', 'The more news I hear like this the more tempted I’m becoming to go all in on GOOG.\n\nThey created the fundamental technology behind machine learning, they employ some of the brightest and most accomplished people in the field, they have the access to more training data than anyone, and they have the funds to scale it.\n\nGoogle are solidly placed to win the AI race, and all this noise about insignificant fines and the like only makes me think that it’s time to get in while sentiment is low.', 'Good.  The US won’t hold them accountable.  \n\nThe search engine is nothing but junk lately.', '„Can’t catch a break“\n\nApparently they also can’t follow laws.', ""Canada also isn't stopping the digital tax for them too."", 'So if they’re facing a 4.7 billion Fine then we should all buy calls!?', ""EU can't innovate tech; can only hope to fine foreign firms into submission in hopes of floating their flagging economies. Sad."", 'After all the layoffs and their destructive policies I have no sympathy. Can only hope the same happens to Facebook', 'It’s always Google', 'Translation:\xa0\n\n“You ran your business so well that you basically have no competition. So now you have to pay us this brib… I MEAN FINE of [insert arbitrary amount of $.] Thank you for your attention to this matter!”', ""the EU isn't a serious entity, they'll eventually get punished for their lack of free markets"", 'The day I put more money in Google thinking that it is undervalued, some shit goes against it.', 'Chance to buy calls on Friday!', 'The EU needs to be held accountable. Their entire strategy recently is to make up for their lack of a free market by fining successful American companies on pent up charges with shady justification. Unreal.', ""Google's free cash flow for the trailing twelve months ending March 31st was roughly $75 billion. \n\nThis fine seems like it's a big deal, but not with that much money coming in every year"", 'Europe main source of revenue in the future will be fining US tech companies', 'Nothing burger. Fine is from 2022. google already made preparations to have the money on hand', 'Oh no\n\nAnyway ...']",https://reddit.com/r/stocks/comments/1lfhex0/google_likely_to_face_47_billion_usd_fine/,['GOOG'],neutral,56.0,positive,61.34545833333333,"[1.8155000000000032, 50.0, 46.694, 64.25, 69.19949999999999, 31.11, 50.0, 89.009, 26.107999999999997, 80.6155, 14.858000000000004, 50.0, 74.4525, 50.0, 94.81299999999999, 120.2915, 91.7525, 112.5065, 69.0805, 97.73649999999999, 72.587, 50.0, 44.9865, 70.749, 70.64250000000001, 29.654000000000003, 50.0, 78.0815, 38.24849999999999, 16.241000000000007, 73.824, 80.12650000000001, 91.44449999999999, 50.0, 85.919, 21.640000000000004]",positive,56.804874999999996,36
stocks,MSFT may terminate expanded OpenAI deal as tensions rise over control and equity,"According to the Financial Times Microsoft may terminate ongoing talks to deepen its partnership with OpenAI citing unresolved disputes over governance and future equity structure

The core issue OpenAI is pushing to formally transition into a for-profit entity which could potentially dilute Microsoft influence and ownership stake in the company  especially concerning any future models beyond GPT-4

Sources say that unless key terms are agreed upon Microsoft is ready to fall back on its existing commercial agreement which guarantees access to OpenAI models through 2030  unless a competitor matches or exceeds Microsoft's deal

Another twist OpenAI transition plan reportedly needs Microsoft formal approval by Dec 31, 2025. Without that green light OpenAI may risk losing interest from outside investors like SoftBank and other late-stage capital.

Despite the headlines, Microsoft commercial use case remains protected in the shorttomid term. But the question now is who controls the roadmap to GPT-5 and beyond  and whether Microsoft sees enough ROI to keep playing ball.

Is MSFT losing strategic leverage here? Or are they just protecting their current ROI？Could this open the door for Google, Amazon, or even Meta to get in bed with OpenAI?How would a fractured OpenAI impact Azure’s AI moat vs AWS and GCP?MSFT may terminate expanded OpenAI deal as tensions rise over control and equity

",Amikuto,65.7415,18,2025-06-18 16:34:05,"['Why did this dump Amazon and Google at 3:50pm? \n\nMicrosoft stock was completely unaffected.', 'Yeah.. openai is now confident enough to secure more funding in absence of msft.. thats what i take from all this debate\nIts hard to see msft let go of the profit after years of patience and investment in openai', 'OpenAI doesn’t have the legal team to handle Microsoft and Sam is going to distracted while they bury him in litigation, delays, stalls. Microsoft will use the next few years to extract all the value they need from OpenAI, fund competitors, then ditch them.\n\nIF OpenAI can secure the funding to run at a loss for a few more years… and I do hope they survive. I use ChatGPT a lot.\n\nIt’s just much more efficient for MSFT to tank OpenAI if it doesn’t get the deal it wants and suck its assets like a vampire. Very classic Legacy Tech move', 'If OpenAI is getting greedy and willing to risk the partnership with Microsoft, I see that as a positive for Microsoft, Google and Meta. \n\nMicrosoft is like Apple; they dont need to be ai leaders just leaders in ai integration. \n\nIn a market competition between OpenAi and Microsoft, Microsoft will always win. OpenAI does not have the large scale network power of companies like Microsoft. If OpenAI leaves microsoft, they are basically forced to always have the best model on the market, otherwise they are easy to leave. This is the opposite with the Microsoft integration, where OpenAI wins by creating a potential business techstack ai monopoly.', 'The existing Microsoft OpenAI licensing deal reportedly totals over $13B in value since inception', 'MSFT closed up 0.46% today, but extended hours show minor pressure (-0.8%) after the FT report', ""Google doesn't need OAI."", 'Those tech founders have never been strangers to volatility lol.', 'Really think OpenAI is making a huge mistake here.  Their only real chance going up against Google is having all the Microsoft properties to integrate with.\n\nGoogle owns so many things that it is going to be next to impossible for OpenAI to compete in the long run.\n\nThe reasons Google will win.\n\n\n\n\n1) They are the only major player that has the entire stack. Google just had far better vision than competitors and started the TPUs over a decade ago.\n\nThis means Google has far less cost as everyone else is stucking in the Nvidia line paying the massive Nvidia tax.\n\n2) Google is on everything unlike anyone else. Android Automotive is now built in cars. Do not confuse with Android Auto. TCL, Hisense and tons of other TVs come with Google built in.\nGoogle has the most popular operating system ever with Android. They have the most popular browser with Chrome. The list goes on and on.\n\n3) Google already has more personal data than any other company on this planet. The ultimate end state is everyone having their own agent.\nThe agent needs to know everything about you and Google has that. Google has Gmail, Google Photos, etc. Nobody else has close to the same.\n\n4) Now the biggest reason Google will win. They are able to add their different services to Gemini. So you have things likeGoogle Maps and Photos and all their other stuff that Gemini will work with.\nGoogle now has 10 services with over a billion DAU. Nobody else has the same.\n\n5) The final reason is nobody is close to Google in terms of AI research. Last NeurIPS, canonical AI research organization, Google had twice the papers accepted as next best.', 'OpenAI is gonna crash and burn lmao. The AI bubble is gonna pop soon.', 'My berkshire gonna moon when this stuff all collapses, that said 6 months to 1.5 years of AI full blown rally would be fun.', 'How can a company become publicly traded and make money, when you used fair use to build your data, which means you cant charge for it from my understanding...', ""so msft strategy of relying on openai backfired. now they don't have models and sinked money into openai."", 'msft has nothing to lose, they are holding openAI by the balls here. \n\nopenAI has been desperately trying to secure funding for .... power plants but that doesnt solve their core problem of **not having a moat**. They will end up as a third world energy  company. msft will find/build better models and repeat the netscape vs explorer saga again', 'Interesting shift. If MSFT loses grip, I wouldn’t be surprised to see Google or Amazon step in hard. AI is too big to sit back on.\n\nThat said, MS still holds the keys for now. Let’s see if OpenAI dares to push without them.', ""Uh the key is OpenAi doesn't have a profitable product and never will. Its a money toilet for MSFT."", 'Rebuttal: They might not.', 'When is OpenAI ipo ? That’s all I care about. No matter the price it opens at, it will double or triple within a month. It’s as sure a buy as anything since Google.']",https://reddit.com/r/stocks/comments/1lertl9/msft_may_terminate_expanded_openai_deal_as/,"['META', 'AMZN', 'MSFT', 'GOOG']",positive,66.9,positive,70.20747222222222,"[38.113, 95.7165, 81.154, 97.35849999999999, 82.89999999999999, 17.247500000000006, 50.0, 91.7525, 104.7515, 75.36, 67.81200000000001, 80.637, 50.0, 63.72, 68.163, 66.55799999999999, 50.0, 82.491]",positive,68.42108333333333,18
